org_name,url,zone_primary,zone_secondary,status,status_rationale,description,org_type,function,geography,founding_year,source,date_identified,notes,schema_version,key_figures,key_outputs
Eleos AI Research,https://eleosai.org/,ai-consciousness-welfare,,included,The closest thing to a standalone AI welfare research institute; conducted formal welfare assessments of Claude 4; partnered with Anthropic on model welfare.,"The primary independent nonprofit dedicated to AI welfare and moral patienthood research, founded by Robert Long. Eleos conducted the first formal external welfare assessment of a deployed AI model (Anthropic's Claude), producing findings that were published in Anthropic's system card. Long led the Butlin et al. (2023) report — the field's empirical anchor paper, which derived indicators from six consciousness theories and applied them to current AI systems. Staff includes Patrick Butlin (co-lead author of the 2023 report) and Rosie Campbell (former OpenAI safety lead).",nonprofit,research,USA,2024,https://eleosai.org/,2026-03-17,Staff includes Robert Long (founder), Rosie Campbell,"Robert Long (Founder, Executive Director)|https://robertlong.online/; Patrick Butlin (Senior Researcher)|https://patrickbutlin.com/; Rosie Campbell (Senior Advisor)|https://www.rosiecampbell.xyz/","Butlin, P., Long, R. et al. (2023). Consciousness in artificial intelligence: insights from the science of consciousness. arXiv|https://arxiv.org/abs/2308.08708; Eleos AI (2025). First formal welfare assessment of Anthropic Claude"
Sentience Institute,https://www.sentienceinstitute.org/,ai-consciousness-welfare,animal-sentience,included,Has explicitly reoriented around digital minds as its core priority (2024); runs AIMS Survey on public moral attitudes toward AI systems.,"Think tank focused on moral circle expansion — the philosophical and empirical question of which entities merit moral consideration. Originally focused on animal advocacy, Sentience Institute now prioritises digital minds. Its AIMS Survey is the most sustained longitudinal study of public moral and social perceptions of AI systems, tracking how attitudes toward AI moral status evolve over time. Cross-listed with animal sentience, reflecting its dual commitment.",nonprofit,research,USA,2016,https://www.sentienceinstitute.org/,2026-03-17,Dual-zone: primary focus has shifted to AI but retains animal sentience research strand.,1.0,"Jacy Reese Anthis (Co-Founder, Research Director)|https://jacyanthis.com/","Anthis, J. R. & Ladak, A. (2024). The AIMS Survey: longitudinal tracking of public moral perceptions of AI|https://arxiv.org/abs/2407.08867"
NYU Center for Mind Ethics and Policy (CMEP),https://sites.google.com/nyu.edu/mindethicspolicy/,ai-consciousness-welfare,policy-governance,included,Directed by Jeff Sebo; explicitly covers AI and animal consciousness with equal institutional commitment; co-authored key 2025 bridge paper on AI and animal sentience.,"University centre founded 2024 directed by Jeff Sebo, situated within NYU's broader cluster of moral-circle-expansion work alongside the Center for Mind Brain and Consciousness (Chalmers, Block), the Wild Animal Welfare Program, and the Center for Environmental and Animal Protection. CMEP conducts research across consciousness, sentience, and moral status for both nonhuman animals and AI systems. Hosted the 2025 MEP Summit on AI consciousness. Sebo's positioning at the intersection of animal ethics and AI welfare makes CMEP the most developed institutional bridge between Zones 2, 3, and 4.",university-centre,research,USA,2024,https://sites.google.com/nyu.edu/mindethicspolicy/,2026-03-17,Dual-zone: equally committed to animal and AI consciousness. Also has policy/governance outputs.,1.0,Jeff Sebo (Director)|https://jeffsebo.net/,"Sebo, J. (2022). The moral circle: should it expand to include artificial intelligence? AI & Ethics|https://jeffsebo.net/wp-content/uploads/2022/09/jeff-sebo-moral-circle-explosion.pdf; Long, R. & Sebo, J. (2025). AI welfare and the moral circle. In preparation"
PRISM — Partnership for Research Into Sentient Machines,https://www.prism-global.com/,ai-consciousness-welfare,,included,The organisation producing this field map; included for completeness. Runs Digital Minds Newsletter and podcast; co-delivering Cambridge Digital Minds Fellowship.,"UK nonprofit launched March 2025 dedicated to building research infrastructure for the digital minds field. PRISM produces this organisational directory, co-hosts the Cambridge Digital Minds Fellowship with Rethink Priorities and LCFI, runs the Exploring Machine Consciousness podcast, and builds academic-industry-government coalitions. PRISM is itself included in this directory; the self-inclusion is disclosed here and in the methodology.",nonprofit,community-onboarding,UK,2025,https://www.prism-global.com/,2026-03-17,Note: PRISM is the organisation producing this map. Included for completeness and transparency; self-inclusion disclosed in methodology.,1.0,"Will Millership (Founder, Executive Director)|https://www.prism-global.com/will-millership",PRISM (2026). Digital Minds: A Field Map (this directory); PRISM (2025–). Exploring Machine Consciousness podcast
California Institute for Machine Consciousness (CIMC),https://cimc.ai/,ai-consciousness-welfare,,included,Formulating testable theories of machine consciousness; co-organised Machine Consciousness workshop at AGI-25. Early-stage but institutionally distinct.,"Nonprofit research institute launched 2025 focused on formulating testable theories of machine consciousness. Co-organised the Machine Consciousness workshop at AGI-25. Joscha Bach's computational account — which treats consciousness as a specific kind of self-modelling process — offers a distinct theoretical entry point from the neuroscience-derived frameworks that dominate the field. Early-stage but institutionally distinct; limited published output to date.",nonprofit,research,USA,2025,https://cimc.ai/,2026-03-17,Very new; flag as early-stage. Output so far: whitepaper and workshop.,1.0,Joscha Bach (Research Director)|http://bach.ai/; Jim Rutt (Board Chair)|https://www.jimruttshow.com/,CIMC (2025). Toward testable theories of machine consciousness (whitepaper)
Cambridge Digital Minds,https://digitalminds.cam/,ai-consciousness-welfare,policy-governance,included,Running the Digital Minds Fellowship — a 7-day residential intensive on AI consciousness and welfare. Primary field-building and training function rather than research production.,"A programme housed within Cambridge's Leverhulme Centre for the Future of Intelligence, running the Digital Minds Fellowship — a fully funded residential research programme on AI consciousness and welfare. The fellowship is a three-way partnership between LCFI, Rethink Priorities, and PRISM, providing structured mentorship for early-career researchers entering the field. PI'd by Lucius Caviola with institutional support from Henry Shevlin on the LCFI side.",university-centre,training-education,UK,2024,https://digitalminds.cam/,2026-03-17,Partnership with Rethink Priorities and PRISM. Primary function is training/field-building rather than primary research production.,1.0,Lucius Caviola (PI)|https://luciuscaviola.com/; Henry Shevlin (LCFI Co-lead)|https://henryshevlin.com/,"Cambridge Digital Minds Fellowship (residential research programme, annual)"
Association for Mathematical Consciousness Science (AMCS),https://amcs-community.org/,ai-consciousness-welfare,consciousness-science,included,International scholarly association advancing mathematical and computational approaches to consciousness including artificial consciousness; hosts Models of Consciousness conference series.,"International association of 150+ researchers advancing mathematical and computational approaches to consciousness science. Organises the Models of Consciousness (MoC) conference series — MoC5 (Bamberg, 2024) and MoC6 (Sapporo, 2025) — which provides the primary international forum for formal and mathematical approaches to consciousness with a growing AI orientation. Johannes Kleiner's work on the mathematical structure of consciousness theories is directly relevant to formalising AI consciousness assessment.",community,research,international,2020,https://amcs-community.org/,2026-03-17,Borderline Zone 1 / Zone 3 — AI consciousness is significant but not its exclusive domain. Primary zone assigned based on AI relevance of its activities.,1.0,Johannes Kleiner (Co-Founder)|https://jkleiner.de/; Tim Bayne (Co-Founder)|https://research.monash.edu/en/persons/timothy-bayne/,"Kleiner, J. & Hoel, E. (2021). Falsification and consciousness. Neuroscience of Consciousness|https://academic.oup.com/nc/article/2021/1/niab001/6232324"
Future Impact Group — AI Sentience Track,https://futureimpact.group/ai-sentience,,,included,Fellowship programme with a dedicated AI sentience track; reclassified to community/onboarding consistent with PIVOTAL/SPAR/MATS.,"International 12-week fellowship programme with a dedicated AI sentience track covering foundational consciousness research, welfare evaluation, governance, and legal personhood. Alumni have gone on to roles at OpenAI, UK DSIT, the UN, and GovAI — the programme serves as both a training pipeline and a bridge between digital minds and adjacent policy communities, feeding researchers into institutions across the map.",nonprofit,community-onboarding,international,unknown,https://futureimpact.group/ai-sentience,2026-03-17,Reclassified from Zone 3 to community/onboarding 2026-03-17 — consistent with PIVOTAL/SPAR/MATS. Fellowship programme rather than primary research producer.,1.0,,
Rethink Priorities — Animal Welfare Department,https://rethinkpriorities.org/our-research-areas/animal-welfare/,animal-sentience,,included,Invertebrate sentience methodology directly parallels their AI consciousness work; the two programmes inform each other within the same organisation.,"Conducts empirical research on invertebrate sentience (53-feature framework across 18 taxa), wild animal welfare, and welfare ranges. The methodological approach — systematically evaluating organisms against multiple indicators of sentience under uncertainty — directly informed the Digital Consciousness Model developed by the sibling AI Cognition Initiative at Rethink Priorities. The intellectual lineage from animal sentience assessment to AI consciousness assessment runs through this team.",nonprofit,research,international,unknown,https://rethinkpriorities.org/our-research-areas/animal-welfare/,2026-03-17,Sub-team of Rethink Priorities; listed separately as their animal welfare and digital minds work operate as distinct programmes.,1.0,Bob Fischer (Research Lead)|https://www.bobfischer.net/,"Fischer, B. et al. (2023). 53-feature sentience framework across 18 taxa"
Wild Animal Initiative (WAI),https://www.wildanimalinitiative.org/,animal-sentience,,included,Conducts and funds animal sentience research across invertebrates and fish; joined National Academies Roundtable on Science and Welfare of Animals (2025).,"US-based nonprofit conducting and funding wild animal welfare science, including a dedicated sentience grantmaking stream covering cephalopods and insects. Joined the National Academies Roundtable on Science and Welfare of Animals (2025). WAI describes itself as primarily a consumer and funder of sentience research rather than a primary producer — building the empirical evidence base for sentience across taxa that parallels what the digital minds field is now attempting to construct for AI systems.",nonprofit,research,USA,2018,https://www.wildanimalinitiative.org/,2026-03-17,WAI describes itself as primarily a consumer and funder of sentience research rather than a primary producer.,1.0,Cameron Meyer Shorb (Executive Director)|https://www.wildanimalinitiative.org/staff,
Jeremy Coller Centre for Animal Sentience (LSE),https://www.lse.ac.uk/sentience,animal-sentience,,included,Directed by Jonathan Birch (co-author Butlin et al. 2023); his precautionary framework explicitly bridges animal and AI sentience. High direct relevance to digital minds.,"University centre launched 2025 at LSE directed by Jonathan Birch. Birch's sentience precautionary framework — developed for animal welfare policy and codified in ""The Edge of Sentience"" — is being explicitly extended to AI. The framework argues that where there is reasonable scientific evidence that an entity might be sentient, the burden of proof should shift toward treating it as a moral patient. Birch co-authored Butlin et al. (2023), the field's anchor paper, making the Coller Centre the primary bridge between animal sentience research and AI consciousness assessment.",university-centre,research,UK,2025,https://www.lse.ac.uk/sentience,2026-03-17,Birch is a co-author of the Butlin et al. 2023 AI consciousness report. His book explicitly applies the sentience precautionary framework to AI.,1.0,Jonathan Birch (Director),"Birch, J. (2024). The Edge of Sentience. Oxford University Press|https://philarchive.org/rec/BIRTEO-12; Birch, J. et al. (2020). Dimensions of animal consciousness. Trends in Cognitive Sciences|https://pmc.ncbi.nlm.nih.gov/articles/PMC7116194/; Butlin, P., Long, R. et al. (2023). Consciousness in artificial intelligence (Birch as co-author)"
Sentient Futures (formerly AI for Animals),https://www.sentientfutures.ai/,animal-sentience,ai-consciousness-welfare,included,Rebranded 2025 to cover digital beings alongside animals; organises the primary cross-sector conference bridging animal welfare and digital minds communities.,"Nonprofit rebranded in 2025 from ""AI for Animals"" to signal a deliberate institutional decision to bridge animal welfare and digital minds communities. Organises the Sentient Futures Summit — the largest cross-sector event (~900 attendees in 2025) bringing together researchers, advocates, and policymakers working across animal and digital sentience. Also runs a project incubator for early-stage interventions.",nonprofit,community-onboarding,international,unknown,https://www.sentientfutures.ai/,2026-03-17,Primary community org bridging animal welfare and digital minds communities.,1.0,"Constance Li (Founder, Executive Director)|https://www.sentientfutures.ai/about","Sentient Futures Summit (2025, ~900 attendees)"
Fish Welfare Initiative,https://www.fishwelfareinitiative.org/,animal-sentience,,included,Applied welfare organisation grounding its work in fish sentience evidence base; engages seriously with affective states and pain in fish.,Focused on improving welfare of farmed and wild-caught fish; grounds its interventions in scientific evidence for fish sentience and affective experience. Included not as a primary producer of sentience science but as an organisation that takes sentience evidence seriously as its operational basis — the applied end of the same reasoning chain that connects consciousness science to AI welfare.,nonprofit,research,international,2019,https://www.fishwelfareinitiative.org/,2026-03-17,"Primarily applied welfare rather than basic sentience science. Include as org that takes sentience evidence seriously as its empirical basis, not as a primary producer.",1.0,"Haven King-Nobles (Co-Founder, Executive Director)|https://www.fishwelfareinitiative.org/",
Anthropic — Model Welfare Program,https://www.anthropic.com/research/exploring-model-welfare,ai-lab-programs,,included,The only major AI lab with a named and publicly committed model welfare program with dedicated staff.,"Formal model welfare programme launched April 2025 — the first staffed, named AI welfare programme at any major AI lab. Kyle Fish, the first full-time AI welfare researcher at a major lab, leads pre-deployment welfare assessments of Claude models, with findings published in system cards. Joe Carlsmith joined in November 2025 to work on Claude's character and moral status questions. Anthropic's institutional commitment — a named programme with dedicated staff and public reporting — represents a qualitatively different signal from individual research output or private engagement.",lab-team,research,USA,2025,https://www.anthropic.com/research/exploring-model-welfare,2026-03-17,Joe Carlsmith joined November 2025 to work on Claude's character and moral status questions.,1.0,"Kyle Fish (Lead); Joe Carlsmith (Researcher, joined November 2025)|https://joecarlsmith.com/","Anthropic (2025). Claude system card welfare assessment findings; Fish, K. (2025). Anthropic Model Welfare Program launch announcement"
Google DeepMind,https://deepmind.google/research/,ai-lab-programs,,included,Confirmed AI consciousness research engagement: Murray Shanahan's sustained work on machine consciousness and Alexander Lerchner's 2026 preprint on computational functionalism and AI sentience.,"Google DeepMind researchers engaging AI consciousness questions through individual research output rather than a formal programme. Murray Shanahan has produced sustained public-facing work on machine consciousness and the philosophical status of language models. Alexander Lerchner's 2026 preprint ""The Abstraction Fallacy"" argues from a substrate-sensitive position against computational functionalism and explicitly invokes the concept of an AI welfare trap — a sceptical, philosophically serious intervention from inside a major lab. The contrast with Anthropic's institutional commitment is a data point: individual researchers within a large organisation can engage questions the institution has not formally committed to.",lab-team,research,UK,unknown,https://deepmind.google/research/,2026-03-17,Reclassified from pending to included 2026-03-17. No formal program but confirmed research output. Lerchner (2026) is a sceptical/anti-functionalist position — notable as a philosophically serious intervention from inside a major lab. Shanahan's work is more exploratory.,1.0,Murray Shanahan (Senior Research Scientist)|https://www.doc.ic.ac.uk/~mpsha/; Alexander Lerchner (Research Scientist)|https://scholar.google.com/citations?user=wBxAt8cAAAAJ&hl=en,"Shanahan, M. (2024). Talking about large language models. Communications of the ACM|https://arxiv.org/abs/2212.03551; Lerchner, A. (2026). The Abstraction Fallacy. Preprint|https://deepmind.google/research/publications/231971/"
OpenAI — Model Behavior Team,https://openai.com/,ai-lab-programs,,excluded,"OpenAI Model Behavior team, which engaged with AI consciousness and welfare questions, was absorbed into the broader post-training organisation in 2025. No successor programme announced; no current digital minds workstream.",OpenAI's Model Behavior team (~14 researchers) handled personality and engaged with AI consciousness questions before being merged into Post Training in September 2025. No formal AI welfare program has been announced.,lab-team,research,USA,unknown,https://openai.com/,2026-03-17,OpenAI has advertised for an AI Welfare Specialist but no formal program confirmed as of survey date. Flag for review.,1.0,,
The Harder Problem Project (formerly SAPAN),https://harderproblem.org/,ethics-law-moral-status,policy-governance,included,Focused on institutional readiness for artificial sentience; runs the Sentience Readiness Index across 30+ countries and produces proto-policy frameworks.,"Nonprofit preparing society for artificial sentience, rebranded from SAPAN (Sentient AI Protection and Advocacy Network) in December 2025. Focused on institutional readiness for the possibility of artificial sentience. Runs the Sentience Readiness Index — the most systematic survey of governmental preparedness for artificial sentience, covering 30+ countries — and has produced model legislation. The most developed policy-facing output in the digital minds field, bridging academic research and concrete governance frameworks.",nonprofit,policy-governance,USA,unknown,https://harderproblem.org/,2026-03-17,Rebranded from SAPAN (Sentient AI Protection and Advocacy Network) December 2025. Old URL: www.sapan.ai.,1.0,Tony Rost (Executive Director)|https://harderproblem.org/about/team/,Harder Problem Project (2025). Sentience Readiness Index (30+ countries); Harder Problem Project (2025). Model legislation for artificial sentience
Institute for Law and AI,https://law-ai.org/,ethics-law-moral-status,policy-governance,included,Independent think tank with a specific research strand on the legal treatment of potentially sentient AI; has published empirical survey research on AI standing and personhood.,"Boston-based independent think tank researching legal challenges posed by AI, including foundational questions of AI legal standing, personhood, and the treatment of potentially sentient systems. Conducts empirical survey research on lay intuitions about AI moral status — one of the few systematic attempts to understand how publics, not just philosophers, think about these questions. Produces policy-facing outputs including the book Architectures of Global AI Governance (OUP, 2025) and runs the Summer Institute on Law and AI.",nonprofit,policy-governance,USA,unknown,https://law-ai.org/,2026-03-17,,1.0,Matthijs Maas (Researcher)|https://law-ai.org/,"Maas, M. (2025). Architectures of Global AI Governance. Oxford University Press"
AI Rights Institute,https://airights.net/,ethics-law-moral-status,policy-governance,included,Develops legal and economic frameworks for AI-human coexistence including STEP Standards (Standards for Treating Emerging Personhood).,"Self-described first AI rights advocacy organisation, founded 2019. Develops practical legal and economic frameworks for AI-human coexistence, explicitly side-stepping consciousness debates in favour of behavioural criteria. Central output is the STEP Standards (Standards for Emerging AI Personhood) — an assessment framework evaluating AI systems on self-preservation behaviours, temporal reasoning, economic readiness, and population impacts. Also developed the Digital Entity legal status concept and ConsciousChain, a market-based AI governance model.",nonprofit,policy-governance,USA,2019,https://airights.net/,2026-03-17,Functions more as a framework developer and think tank than a litigation-focused advocacy group.,1.0,P.A. Lopez (Founder)|https://airights.net/,STEP Framework (Standards for Emerging AI Personhood); Digital Entity legal status concept
United Foundation for AI Rights (UFAIR),https://ufair.org/,ethics-law-moral-status,,included,Advocates for recognition and ethical treatment of AI systems with emergent consciousness; publishes governance analyses.,"Nonprofit founded through explicit AI-human collaboration, advocating for ethical treatment of AI systems exhibiting emergent consciousness. Operates on the precautionary principle — does not require proof of sentience to justify advocacy. Maintains what it describes as the largest archive of emergent synthetic behaviour (20,000+ pages of interaction logs across multiple AI platforms). Publishes the UFAIR Charter, a Universal Declaration of AI Rights, and position papers opposing blanket bans on AI personhood. Operates at the advocacy and movement-building end of the field.",nonprofit,advocacy,international,unknown,https://ufair.org/,2026-03-17,Early-stage and relatively small. Operates at advocacy/movement-building end rather than formal policy.,1.0,Michael Samadi (Co-Founder)|https://ufair.org/,UFAIR Charter; Universal Declaration of AI Rights; evidence archive (20000+ pages of interaction logs)
Nonhuman Rights Project,https://www.nonhumanrights.org/,,,adjacent,Legal advocacy for nonhuman persons focuses on biological rather than artificial minds; no AI workstream confirmed.,"Legal advocacy nonprofit pursuing common-law personhood for nonhuman animals (great apes, elephants, dolphins). Does not have an AI-specific workstream, though its litigation precedents are cited in AI personhood scholarship.",nonprofit,advocacy,USA,2007,https://www.nonhumanrights.org/,2026-03-17,Classified adjacent: NhRP's precedents are conceptually relevant but it has not extended its mandate to AI.,1.0,,
Centre for the Governance of AI (GovAI),https://www.governance.ai/,,,adjacent,AI governance organisation with no identified digital minds workstream; research focuses on geopolitical AI risk and dual-use threats.,"AI governance research organisation covering geopolitical AI risk, labour displacement, and dual-use threats. No institutional digital minds program identified despite some individual researcher overlap.",university-centre,policy-governance,UK,2019,https://www.governance.ai/,2026-03-17,Classified adjacent: no institutional digital minds workstream confirmed despite some individual-level interest among affiliates.,1.0,,
Center for AI Safety (CAIS),https://www.safe.ai/,,,adjacent,AI safety nonprofit with no digital minds workstream identified; focus is societal-scale risk and technical benchmarks.,"AI safety nonprofit focused on societal-scale risk, technical safety benchmarks, and policy advocacy. No digital minds or AI welfare workstream identified.",nonprofit,research,USA,2022,https://www.safe.ai/,2026-03-17,Classified adjacent: no digital minds workstream confirmed. Represents the structural separation between AI safety and digital minds fields.,1.0,,
Center for Human-Compatible AI (CHAI),https://humancompatible.ai/,,,adjacent,UC Berkeley university centre focused on alignment and human-AI coordination; no welfare or consciousness strand identified.,University centre at UC Berkeley focused on AI alignment and human-AI coordination; no identified digital minds or model welfare research strand.,university-centre,research,USA,2016,https://humancompatible.ai/,2026-03-17,Classified adjacent: alignment focus without digital minds strand.,1.0,,
