org_name,url,zone_primary,zone_secondary,status,status_rationale,description,org_type,function,geography,founding_year,source,date_identified,notes,schema_version,key_figures,key_outputs
Center for Sleep and Consciousness (UW–Madison),https://centerforsleepandconsciousness.psychiatry.wisc.edu/,consciousness-science,,included,Primary institutional home of Integrated Information Theory (IIT); directly relevant to AI consciousness assessment frameworks.,"Giulio Tononi's lab at UW–Madison; the primary home of Integrated Information Theory (IIT), which proposes a mathematical measure of consciousness (Φ) based on information integration. IIT's framework has been directly applied to AI consciousness assessment — it is one of six theories used in Butlin et al. (2023) to derive indicators for evaluating AI systems, and a core input to Rethink Priorities' Digital Consciousness Model.",university-centre,research,USA,1997,https://centerforsleepandconsciousness.psychiatry.wisc.edu/,2026-03-17,,1.0,"Giulio Tononi (Director, IIT originator)|https://centerforsleepandconsciousness.psychiatry.wisc.edu/people/principal-investigator-giulio-tononi/","Tononi, G. (2004). An information integration theory of consciousness. BMC Neuroscience|https://pmc.ncbi.nlm.nih.gov/articles/PMC543470/; Tononi, G. et al. (2016). Integrated information theory: from consciousness to its physical substrate. Nature Reviews Neuroscience|https://www.nature.com/articles/nrn.2016.44; Albantakis, L. et al. (2023). Integrated information theory (IIT) 4.0. arXiv|https://arxiv.org/abs/2212.14787"
Center for Consciousness Studies (University of Arizona),https://consciousnesscenter.arizona.edu/,consciousness-science,,excluded,Reclassified to excluded — foundational conference infrastructure but no direct AI consciousness research engagement; MoC conference connections captured under AMCS.,"The longest-running dedicated consciousness research centre, founded with Chalmers' involvement; hosts the annual Toward a Science of Consciousness conference bridging empirical neuroscience and philosophy of mind.",university-centre,research,USA,1998,https://consciousnesscenter.arizona.edu/,2026-03-17,,1.0,,
Center for Consciousness Science (University of Michigan),https://medresearch.umich.edu/labs-departments/centers/consciousness-science,consciousness-science,,included,Multidisciplinary centre with strong empirical grounding relevant to minimal consciousness criteria — directly applicable to AI consciousness debates.,"Multidisciplinary centre at the University of Michigan directed by George Mashour, advancing research on consciousness with emphasis on disorders of consciousness and neural correlates of awareness. Mashour's work on the global neuronal workspace hypothesis and his development of minimal consciousness criteria — distinguishing conscious from unconscious states in biological systems — provides direct methodological precedents for assessing whether AI systems might cross similar thresholds.",university-centre,research,USA,unknown,https://medresearch.umich.edu/labs-departments/centers/consciousness-science,2026-03-17,,1.0,George Mashour (Director)|https://consciousness.med.umich.edu/people-mashour/,"Mashour, G. A. et al. (2020). Conscious processing and the global neuronal workspace hypothesis. Neuron|https://pmc.ncbi.nlm.nih.gov/articles/PMC8770991/"
Sussex Centre for Consciousness Science,https://www.sussex.ac.uk/research/centres/sussex-centre-for-consciousness-science/,consciousness-science,,included,Anil Seth's predictive processing / interoceptive-inference account has direct AI relevance; centre actively hosts AI-consciousness events.,"Directed by Anil Seth; integrates neuroscience, psychology, and computational modelling of consciousness. Seth's predictive processing account — which grounds consciousness in the brain's predictions about internal bodily states — has been directly applied to AI consciousness questions. Seth won the 2025 Berggruen essay prize for ""The Mythology of Conscious AI,"" a sceptical intervention arguing against premature AI consciousness claims.",university-centre,research,UK,2010,https://www.sussex.ac.uk/research/centres/sussex-centre-for-consciousness-science/,2026-03-17,,1.0,Anil Seth (Director)|https://www.anilseth.com/,"Seth, A. K. (2021). Being You: A New Science of Consciousness. Faber & Faber|https://www.anilseth.com/being-you/; Seth, A. K. (2025). The mythology of conscious AI. Noema / Berggruen Prize Essay|https://www.noemamag.com/the-mythology-of-conscious-ai/; Seth, A. K. & Bayne, T. (2022). Theories of consciousness. Nature Reviews Neuroscience|https://www.nature.com/articles/s41583-022-00587-4"
Wellcome Centre for Human Neuroimaging / FIL (UCL),https://www.fil.ion.ucl.ac.uk/,consciousness-science,,included,Karl Friston's institutional base; free energy principle and active inference have growing direct application to AI consciousness and agency modelling.,"Karl Friston's home lab at UCL; the world's leading centre for computational neuroimaging. Friston's free energy principle — a mathematical framework proposing that all adaptive systems minimise prediction error — is increasingly applied to model AI consciousness and agency, providing a formal bridge between biological and artificial systems. The active inference framework derived from this work is now being tested in artificial agents.",university-centre,research,UK,1994,https://www.fil.ion.ucl.ac.uk/,2026-03-17,,1.0,Karl Friston (Scientific Director)|https://www.fil.ion.ucl.ac.uk/~karl/,"Friston, K. (2010). The free-energy principle: a unified brain theory? Nature Reviews Neuroscience|https://www.fil.ion.ucl.ac.uk/~karl/NRN.pdf; Friston, K. et al. (2022). Active inference and the free energy principle. Trends in Cognitive Sciences|https://direct.mit.edu/books/oa-monograph/5299/Active-InferenceThe-Free-Energy-Principle-in-Mind"
UNICOG / NeuroSpin (CEA Paris-Saclay),https://joliot.cea.fr/drf/joliot/en/Pages/research_entities/NeuroSpin.aspx,consciousness-science,,included,Stanislas Dehaene's lab; primary institutional base for Global Neuronal Workspace (GNW) theory; directly involved in IIT vs GWT adversarial collaboration.,"Stanislas Dehaene's lab at CEA Paris-Saclay; the primary institutional base for Global Neuronal Workspace (GNW) theory, which proposes that consciousness arises when information is broadcast across a network of interconnected cortical areas. GNW is one of the most directly applicable theories for AI: its emphasis on information broadcasting and access has clear architectural analogues in transformer models, making it a key framework in AI consciousness assessment.",university-centre,research,France,2006,https://joliot.cea.fr/drf/joliot/en/Pages/research_entities/NeuroSpin.aspx,2026-03-17,National research lab rather than university department — org_type reflects this ambiguity.,1.0,Stanislas Dehaene (Director)|https://www.college-de-france.fr/en/chair/stanislas-dehaene-experimental-cognitive-psychology-statutory-chair/biography,"Dehaene, S. & Changeux, J.-P. (2011). Experimental and theoretical approaches to conscious processing. Neuron|https://www.unicog.org/publications/DehaeneChangeux_ReviewConsciousness_Neuron2011.pdf; Dehaene, S. (2014). Consciousness and the Brain. Viking|https://pmc.ncbi.nlm.nih.gov/articles/PMC3971003/"
Brain and Cognition Group (University of Amsterdam),https://www.uva.nl/en/research/uva-research-institutes/brain-and-cognition/brain-and-cognition.html,consciousness-science,,included,Victor Lamme's Recurrent Processing Theory (RPT) is a major rival to IIT and GNW in AI consciousness debates.,"Victor Lamme's research group at the University of Amsterdam; home of Recurrent Processing Theory (RPT), which holds that recurrent local cortical feedback is necessary and sufficient for phenomenal consciousness. RPT is a major rival to IIT and GNW in AI consciousness debates, tested against both in the COGITATE adversarial collaboration, and is one of the theories applied to AI systems in Butlin et al. (2023).",university-centre,research,Netherlands,unknown,https://www.uva.nl/en/research/uva-research-institutes/brain-and-cognition/brain-and-cognition.html,2026-03-17,,1.0,Victor Lamme (PI)|https://scholar.google.com/citations?user=QU5-DJEAAAAJ&hl=en,"Lamme, V. A. F. (2003). Why visual attention and awareness are different. Trends in Cognitive Sciences|https://philpapers.org/rec/LAMWVA; Lamme, V. A. F. (2006). Towards a true neural stance on consciousness. Trends in Cognitive Sciences|https://philpapers.org/rec/LAMTAT-3"
Paris Brain Institute — PICNIC Group,https://parisbraininstitute.org/brain-function-cards/consciousness,consciousness-science,,included,One of Europe's premier clinical-consciousness neuroscience groups; theoretical reach into global workspace accounts.,"Clinical consciousness neuroscience group at the Paris Brain Institute (Institut du Cerveau), led by Jacobo Sitt. Investigates disorders of consciousness and neural correlates of awareness using large-scale brain signal screening and machine learning classification. Its theoretical connections to Global Workspace Theory — one of the consciousness frameworks most directly applicable to AI — make PICNIC's clinical work relevant to the question of how consciousness might be detected in artificial systems.",university-centre,research,France,unknown,https://parisbraininstitute.org/brain-function-cards/consciousness,2026-03-17,,1.0,Jacobo Sitt (Group Leader)|https://parisbraininstitute.org/collaborators/jacobo-sitt,"Sitt, J. D. et al. (2014). Large scale screening of neural signatures of consciousness. Brain|https://pmc.ncbi.nlm.nih.gov/articles/PMC4610185/"
Institute for Advanced Consciousness Studies (IACS),https://advancedconsciousness.org/,consciousness-science,,included,Independent nonprofit using neuroimaging and neuromodulation to study discrete consciousness states; more experimentally than theoretically focused.,"Independent nonprofit research lab based in Santa Monica, California. Uses neuroimaging, neuromodulation, and systematic study of altered states — including psychedelics and meditation — to identify neural correlates of discrete consciousness states. More experimentally than theoretically focused, IACS occupies a distinctive niche: generating empirical data on the boundaries of conscious experience that consciousness theories applied to AI must ultimately account for.",nonprofit,research,USA,2019,https://advancedconsciousness.org/,2026-03-17,,1.0,Nicco Reggente (PI)|https://advancedconsciousness.org/nicco-reggente/,
Allen Institute — Brain and Consciousness Division,https://alleninstitute.org/division/consciousness/,consciousness-science,,included,Christof Koch drove the Neural Correlates of Consciousness programme here; Allen Institute data are used in empirical tests of IIT and GWT.,"Research division at the Allen Institute seeking to understand the physical substrate of consciousness in the mammalian brain. Christof Koch drove the Neural Correlates of Consciousness programme here. Its MindScope program maps large-scale neural activity and serves as a primary node in the COGITATE adversarial collaboration — the most ambitious empirical test of competing consciousness theories, whose results inform which frameworks are most applicable to AI.",nonprofit,research,USA,2003,https://alleninstitute.org/division/consciousness/,2026-03-17,,1.0,Christof Koch (former Chief Scientist)|https://christofkoch.com/,"Koch, C. et al. (2016). Neural correlates of consciousness: progress and problems. Nature Reviews Neuroscience|https://www.nature.com/articles/nrn.2016.22; Koch, C. (2019). The Feeling of Life Itself. MIT Press|https://mitpress.mit.edu/9780262539555/the-feeling-of-life-itself/"
Monash Centre for Consciousness and Contemplative Studies (M3CS),https://www.monash.edu/consciousness-contemplative-studies,consciousness-science,,included,Directed by Jakob Hohwy; strong theoretical reach via predictive processing and advisory committee including Metzinger.,"Interdisciplinary centre at Monash University directed by Jakob Hohwy, integrating consciousness research with contemplative science. Hohwy's predictive processing framework — closely related to Seth's and Friston's accounts — connects to AI consciousness debates by offering a computational theory of subjective experience that can, in principle, be evaluated in artificial systems. Advisory committee includes Thomas Metzinger, whose phenomenal self-model work is directly relevant to AI self-awareness questions.",university-centre,research,Australia,unknown,https://www.monash.edu/consciousness-contemplative-studies,2026-03-17,,1.0,Jakob Hohwy (Director)|https://research.monash.edu/en/persons/jakob-hohwy/,"Hohwy, J. (2013). The Predictive Mind. Oxford University Press|https://academic.oup.com/book/4105"
Active Inference Institute,https://www.activeinference.institute/,consciousness-science,,included,Growing bridge between Friston's theoretical neuroscience of consciousness and AI/robotics communities.,"US nonprofit dedicated to education and research on active inference and the free energy principle, founded 2021. Runs symposia, courses, and textbook groups that bridge theoretical consciousness science and AI, providing a community entry point for researchers interested in how Friston's mathematical framework applies to artificial agents and consciousness. Functions as a growing bridge between Friston's theoretical neuroscience and the AI/robotics communities exploring its implications.",nonprofit,research,USA,2021,https://www.activeinference.institute/,2026-03-17,,1.0,Daniel Friedman (President)|https://www.danielarifriedman.com/research.html,"Friedman, D. et al. (2022). Active Inference Institute: a participatory community for the study of active inference. Active Inference Institute|https://www.activeinference.institute/"
Association for the Scientific Study of Consciousness (ASSC),https://theassc.org/,consciousness-science,,included,Primary international professional body for consciousness research; organises annual conference spanning neuroscience,"The primary international professional society for consciousness research, established 1994. Runs the annual ASSC conference — the field's largest scientific gathering — which increasingly features dedicated AI consciousness sessions. Publishes Neuroscience of Consciousness (Oxford University Press). ASSC27 (Tokyo, 2024), hosted by Araya Inc, and ASSC28 reflect growing engagement with questions about artificial consciousness alongside the society's traditional neuroscience and philosophy focus.",nonprofit,community-onboarding,international,1994,https://theassc.org/,2026-03-17,,1.0,,
Graziano Lab (Princeton University),https://grazianolab.com/,consciousness-science,,included,Home of Attention Schema Theory (AST) — a major competing theory of consciousness with direct and explicit application to AI consciousness questions.,"Michael Graziano's lab at Princeton; develops Attention Schema Theory (AST), which proposes consciousness arises from the brain's internal model of its own attentional processes. AST is arguably the consciousness theory most readily applied to AI systems, since attention mechanisms are a core architectural feature of modern AI. AE Studio has directly funded Graziano's research to advance this application.",university-centre,research,USA,unknown,https://grazianolab.com/,2026-03-17,"Added following user flag 2026-03-17. AST is one of the four major competing theories (alongside IIT, GWT, RPT) represented in the corpus. AE Studio has funded Graziano's research.",1.0,Michael Graziano (PI)|https://grazianolab.princeton.edu/,"Graziano, M. S. A. (2013). Consciousness and the Social Brain. Oxford University Press|https://archive.org/details/consciousnesssoc0000graz; Graziano, M. S. A. (2019). Rethinking Consciousness: A Scientific Theory of Subjective Experience. W. W. Norton|https://grazianolab.princeton.edu/publications/rethinking-consciousness-scientific-theory-subjective-experience"
MIND Group / Open MIND Network,https://open-mind.net/,consciousness-science,,included,International early-career network with significant output in philosophy of consciousness; produced the landmark open-access Open MIND collection.,"International research network founded by Thomas Metzinger in 2003; brings together early-career philosophers and scientists working on consciousness and cognition. Produced the landmark Open MIND collection — 39 open-access target articles with commentaries. Metzinger's ""no-self"" theory and his concept of the phenomenal self-model have been applied to AI consciousness debates — particularly the question of whether AI systems could have self-models without genuine phenomenal experience.",community,research,international,2003,https://open-mind.net/,2026-03-17,,1.0,Thomas Metzinger (Founder)|https://thomasmetzinger.com/,"Metzinger, T. (2003). Being No One. MIT Press|https://direct.mit.edu/books/monograph/1991/Being-No-OneThe-Self-Model-Theory-of-Subjectivity; Metzinger, T. (ed.) (2015). Open MIND. MIND Group|https://open-mind.net/"
NYU Center for Mind Brain and Consciousness,https://wp.nyu.edu/consciousness/,philosophy-of-mind,,included,Co-directed by Chalmers and Block; the leading academic philosophy-of-mind centre with direct AI consciousness relevance; hosted Claude 4 model welfare assessment event (2025).,"Philosophy-of-mind research centre at NYU co-directed by David Chalmers and Ned Block — arguably the two most influential living philosophers of consciousness. Hosts events directly addressing AI consciousness and welfare, including a 2025 assessment of Anthropic's Claude 4. Part of the broader NYU moral-circle-expansion cluster alongside CMEP (Sebo), CEAP, and the Wild Animal Welfare Program.",university-centre,research,USA,unknown,https://wp.nyu.edu/consciousness/,2026-03-17,,1.0,David Chalmers (Co-Director)|https://consc.net/; Ned Block (Co-Director)|https://www.nedblock.us/,"Chalmers, D. J. (1996). The Conscious Mind. Oxford University Press|https://consc.net/the-conscious-mind/; Block, N. (1995). On a confusion about a function of consciousness. Behavioral and Brain Sciences|https://philpapers.org/rec/BLOOAC; Chalmers, D. J. (2023). Could a large language model be conscious? Boston Review|https://www.bostonreview.net/articles/could-a-large-language-model-be-conscious/"
Centre for Consciousness (ANU),https://philosophy.cass.anu.edu.au/centres/consciousness,philosophy-of-mind,,included,Chalmers founded this centre; institutional home for philosophy-of-consciousness research with direct relevance to AI consciousness debates.,"Research centre at the Australian National University founded by David Chalmers in 2004, dedicated to philosophy of consciousness and philosophy of mind. Runs active workshops on reflexive and higher-order theories of consciousness. As Chalmers' original institutional home for consciousness research — predating NYU CMBC — the centre retains significance in the field's intellectual geography.",university-centre,research,Australia,2004,https://philosophy.cass.anu.edu.au/centres/consciousness,2026-03-17,,1.0,David Chalmers (Founder)|https://consc.net/,"Chalmers, D. J. (1995). Facing up to the problem of consciousness. Journal of Consciousness Studies|https://consc.net/papers/facing.pdf"
Leverhulme Centre for the Future of Intelligence (LCFI),https://www.lcfi.ac.uk/,philosophy-of-mind,,included,One of the most active academic sites for philosophy of AI consciousness in Europe; Henry Shevlin's work directly addresses non-human consciousness and moral patiency.,"Leverhulme-funded interdisciplinary centre at Cambridge studying the long-term challenges posed by AI, including consciousness, moral patiency, and welfare. Henry Shevlin's work on non-human consciousness and moral patienthood applies directly to AI welfare reasoning. LCFI partners with PRISM on the Cambridge Digital Minds Fellowship and provides the institutional bridge between academic philosophy of mind and applied field-building in digital minds.",university-centre,research,UK,2016,https://www.lcfi.ac.uk/,2026-03-17,,1.0,Stephen Cave (Director)|https://www.lcfi.ac.uk/people/stephen-cave; Henry Shevlin (Research Associate)|https://henryshevlin.com/,"Shevlin, H. (2021). Non-human consciousness and the specificity problem. Mind & Language|https://philpapers.org/rec/SHENCA-2"
Oxford Uehiro Centre for Practical Ethics,https://www.practicalethics.ox.ac.uk/,ethics-law-moral-status,philosophy-of-mind,included,Covers AI and digital ethics including normative questions downstream of consciousness attributions; organises policy-facing outputs.,"Oxford philosophy centre covering AI ethics, neuroethics, and human enhancement. The University of Oxford previously hosted both the Future of Humanity Institute (FHI) and the Global Priorities Institute (GPI) — research centres that served as catalysts for work on AI welfare. Following the closure of both, research into digital minds questions continues primarily within the Faculty of Philosophy, where the Uehiro Centre's researchers examine fundamental questions about moral agency, ethical treatment of AI systems, and the potential risks of digital consciousness. Several former FHI and GPI researchers remain active in the Oxford philosophy community.",university-centre,research,UK,1998,https://www.practicalethics.ox.ac.uk/,2026-03-17,,1.0,Julian Savulescu (former Director)|https://law.unimelb.edu.au/about/staff/julian-savulescu; Andreas Mogensen (Senior Research Fellow)|https://www.andreasmogensen.com/; Bradford Saad (Senior Research Fellow)|https://sites.google.com/a/brown.edu/brad-saad/,"Bradley, B. & Saad, B. (forthcoming). Varieties of moral agency and risks of digital dystopia. American Philosophical Quarterly|https://philarchive.org/rec/BRAVOM-2; Bradley, B. & Saad, B. (forthcoming). AI alignment vs AI ethical treatment: ten challenges. Analytic Philosophy|https://www.globalprioritiesinstitute.org/wp-content/uploads/Bradley-and-Saad-AI-alignment-vs-AI-ethical-treatment_-Ten-challenges.pdf; Bales, A. (2025). Against willing AI servitude. The Philosophical Quarterly|https://www.globalprioritiesinstitute.org/wp-content/uploads/Adam-Bales-Against-Willing-Servitude.pdf"
Global Priorities Institute (GPI),https://www.globalprioritiesinstitute.org/,philosophy-of-mind,,excluded,Closed — confirmed by user (2026-03-17). Produced foundational early research on AI sentience and moral status.,Oxford interdisciplinary research centre on global priorities; formally closed. Key contributions include Patrick Butlin's work on AI consciousness indicators and 2025 publications on societal response to potentially sentient AI.,university-centre,research,UK,2017,https://www.globalprioritiesinstitute.org/,2026-03-17,Excluded: defunct. Historically significant — produced foundational early research including Butlin et al. 2023. User confirmed closure 2026-03-17.,1.0,,
CUNY Graduate Center — Philosophy / Consciousness (Rosenthal),https://www.gc.cuny.edu/philosophy,philosophy-of-mind,consciousness-science,included,David Rosenthal's Higher-Order Thought (HOT) theory has been explicitly applied to AI consciousness assessment; straddles philosophy and consciousness science.,"David Rosenthal's home base at CUNY Graduate Center; the primary institutional site for Higher-Order Thought (HOT) theory of consciousness. HOT proposes that a mental state is conscious when accompanied by a higher-order representation of being in that state — a framework increasingly applied to AI consciousness assessment by Rosenthal, Hakwan Lau, and Richard Brown. HOT is one of the six theories used in Butlin et al. (2023).",university-centre,research,USA,unknown,https://www.gc.cuny.edu/philosophy,2026-03-17,,1.0,David Rosenthal (Distinguished Professor)|https://www.davidrosenthal.org/,"Rosenthal, D. (2005). Consciousness and Mind. Oxford University Press|https://academic.oup.com/book/49740; Lau, H. & Rosenthal, D. (2011). Empirical support for higher-order theories of conscious awareness. Trends in Cognitive Sciences|https://philpapers.org/rec/LAUECF"
Rethink Priorities — AI Cognition Initiative,https://rethinkpriorities.org/research-area/the-welfare-of-digital-minds/,ai-consciousness-welfare,,included,The leading nonprofit research team in the digital minds space; developed the Digital Consciousness Model scoring 200 indicators across 13 theories of consciousness.,"Five-researcher team within Rethink Priorities producing the Digital Consciousness Model (DCM) — the first systematic probabilistic framework for assessing the moral relevance of AI systems. The DCM evaluates systems against 13 theories of consciousness simultaneously, generating probability distributions rather than binary verdicts. The team also partners with Cambridge Digital Minds and PRISM on the Digital Minds Fellowship, providing mentorship for the next generation of researchers entering the field.",nonprofit,research,international,2022,https://rethinkpriorities.org/research-area/the-welfare-of-digital-minds/,2026-03-17,Sub-team of Rethink Priorities; listed separately as their digital minds and animal welfare work operate as distinct programmes.,1.0,Bob Fischer (Research Lead)|https://www.bobfischer.net/; Leonard Dung (Senior Researcher)|https://sites.google.com/view/leonard-dung/home,"Rethink Priorities (2024). Digital Consciousness Model (DCM) — probabilistic framework assessing consciousness across 13 theories; Fischer, B. & Sebo, J. (forthcoming). AI welfare: a framework"
